mysql> UPDATE Account SET password = "notsecret" WHERE id=3 LIMIT 1;
Query OK, 1 row affected (0.02 sec)
Rows matched: 1  Changed: 1  Warnings: 0

mysql> SELECT * FROM Account;
+----+-------------+-----------+---------------------+---------------------+
| id | email       | password  | createdOn           | modifiedOn          |
+----+-------------+-----------+---------------------+---------------------+
|  3 | m@gmail.com | notsecret | 2014-11-11 00:00:00 | 2015-11-12 00:00:00 |
+----+-------------+-----------+---------------------+---------------------+
1 row in set (0.00 sec)

mysql> UPDATE AddressBook SET modifiedOn = NOW() WHERE id = 1;
Query OK, 1 row affected (0.01 sec)
Rows matched: 1  Changed: 1  Warnings: 0

mysql> SELECT * FROM AddressBook;
+----+-----------+-------+---------------------+---------------------+
| id | accountId | name  | createdOn           | modifiedOn          |
+----+-----------+-------+---------------------+---------------------+
|  1 |         3 | Marie | 2012-03-12 00:00:00 | 2016-04-26 17:59:15 |
+----+-----------+-------+---------------------+---------------------+
1 row in set (0.00 sec)

mysql> UPDATE Entry 
    ->     SET lastName = CASE id 
    ->         WHEN 1 THEN "Letellier"
    ->         WHEN 2 THEN "Ekmej"
    ->         WHEN 3 THEN "Godon"
    ->     END
    -> WHERE id IN (1,2,3);
Query OK, 3 rows affected (0.01 sec)
Rows matched: 3  Changed: 3  Warnings: 0

mysql> SELECT id, addressBookId, firstName, lastName, birthday, type, subtype, contentLineOne FROM Entry;
+----+---------------+-----------+-----------+---------------------+-------+---------+----------------+
| id | addressBookId | firstName | lastName  | birthday            | type  | subtype | contentLineOne |
+----+---------------+-----------+-----------+---------------------+-------+---------+----------------+
|  1 |             1 | Marie     | Letellier | 1991-12-19 00:00:00 | home  | phone   | some address   |
|  2 |             2 | David     | Ekmej     | 1991-12-12 00:00:00 | work  |         | blah           |
|  3 |            56 | Steph     | Godon     | 1984-08-10 00:00:00 | other | email   | content        |
+----+---------------+-----------+-----------+---------------------+-------+---------+----------------+
3 rows in set (0.00 sec)